17:12:19.101936 IP 192.168.0.108.58932 > 239.255.255.250.1900: UDP, length 133
17:12:21.004042 IP 91.189.89.144.80 > 192.168.0.105.49670: Flags [F.], seq 3119346671, ack 1690565795, win 46, options [nop,nop,TS val 2416693186 ecr 4294899768], length 0
17:12:21.040284 IP 192.168.0.105.49670 > 91.189.89.144.80: Flags [.], ack 3119346672, win 125, options [nop,nop,TS val 4294903529 ecr 2416693186], length 0
17:12:22.172164 IP 192.168.0.108.58932 > 239.255.255.250.1900: UDP, length 133
17:12:32.169771 IP 192.168.0.104.137 > 192.168.0.255.137: NBT UDP PACKET(137): QUERY; REQUEST; BROADCAST
17:12:32.920188 IP 192.168.0.104.137 > 192.168.0.255.137: NBT UDP PACKET(137): QUERY; REQUEST; BROADCAST
17:12:33.670590 IP 192.168.0.104.137 > 192.168.0.255.137: NBT UDP PACKET(137): QUERY; REQUEST; BROADCAST
17:12:45.769600 IP6 fe80::15b:24dc:784e:9185.546 > ff02::1:2.547: dhcp6 solicit
17:12:46.769235 IP6 fe80::15b:24dc:784e:9185.546 > ff02::1:2.547: dhcp6 solicit
17:12:46.774935 IP 192.168.0.105.16575 > 192.168.0.1.53: 15871+ A? daisy.ubuntu.com. (34)
17:12:46.776848 IP 192.168.0.1.53 > 192.168.0.105.16575: 15871 2/0/0 A 91.189.95.55, A 91.189.95.54 (66)
17:12:48.768309 IP6 fe80::15b:24dc:784e:9185.546 > ff02::1:2.547: dhcp6 solicit
17:12:51.788306 ARP, Request who-has 192.168.0.1 tell 192.168.0.105, length 28
17:12:51.790232 ARP, Reply 192.168.0.1 is-at 00:02:6f:5a:0d:64, length 46
17:12:52.765979 IP6 fe80::15b:24dc:784e:9185.546 > ff02::1:2.547: dhcp6 solicit
17:12:54.031110 IP 192.168.0.105.41442 > 192.168.0.1.53: 8808+ A? daisy.ubuntu.com. (34)
17:12:54.033265 IP 192.168.0.1.53 > 192.168.0.105.41442: 8808 2/0/0 A 91.189.95.54, A 91.189.95.55 (66)
17:12:55.035624 IP 192.168.0.105.33975 > 192.168.0.1.53: 35702+ A? daisy.ubuntu.com. (34)
17:12:55.038546 IP 192.168.0.1.53 > 192.168.0.105.33975: 35702 2/0/0 A 91.189.95.55, A 91.189.95.54 (66)
17:12:59.025258 ARP, Request who-has 192.168.0.105 tell 192.168.0.1, length 46
17:13:00.026009 ARP, Request who-has 192.168.0.105 tell 192.168.0.1, length 46
17:13:00.762776 IP6 fe80::15b:24dc:784e:9185.546 > ff02::1:2.547: dhcp6 solicit
17:13:01.024738 ARP, Request who-has 192.168.0.105 tell 192.168.0.1, length 46
17:13:02.087056 ARP, Request who-has 192.168.0.105 tell 192.168.0.1, length 46
17:13:02.087075 ARP, Reply 192.168.0.105 is-at 08:00:27:9c:5f:72, length 28
17:13:02.174908 IP 192.168.0.105.27632 > 192.168.0.1.53: 34913+ AAAA? changelogs.ubuntu.com. (39)
17:13:02.189504 IP 192.168.0.1.53 > 192.168.0.105.27632: 34913 0/1/0 (100)
17:13:02.189931 IP 192.168.0.105.49964 > 192.168.0.1.53: 28649+ AAAA? changelogs.ubuntu.com.rnxn4ps. (47)
17:13:02.277520 IP 192.168.0.1.53 > 192.168.0.105.49964: 28649 0/0/0 (47)
17:13:02.277858 IP 192.168.0.105.40879 > 192.168.0.1.53: 15921+ A? changelogs.ubuntu.com. (39)
17:13:02.291664 IP 192.168.0.1.53 > 192.168.0.105.40879: 15921 1/3/3 A 91.189.95.36 (167)
17:13:04.129674 IP 192.168.0.105.51525 > 91.189.95.36.80: Flags [S], seq 2481859466, win 14600, options [mss 1460,sackOK,TS val 4294914301 ecr 0,nop,wscale 7], length 0
17:13:04.295923 IP 91.189.95.36.80 > 192.168.0.105.51525: Flags [S.], seq 2975228100, ack 2481859467, win 14480, options [mss 1460,sackOK,TS val 2336523150 ecr 4294914301,nop,wscale 7], length 0
17:13:04.295965 IP 192.168.0.105.51525 > 91.189.95.36.80: Flags [.], ack 2975228101, win 115, options [nop,nop,TS val 4294914342 ecr 2336523150], length 0
17:13:04.382467 IP 192.168.0.105.51525 > 91.189.95.36.80: Flags [P.], seq 2481859467:2481859691, ack 2975228101, win 115, options [nop,nop,TS val 4294914364 ecr 2336523150], length 224
17:13:04.549835 IP 91.189.95.36.80 > 192.168.0.105.51525: Flags [.], ack 2481859691, win 122, options [nop,nop,TS val 2336523213 ecr 4294914364], length 0
17:13:04.549889 IP 91.189.95.36.80 > 192.168.0.105.51525: Flags [P.], seq 2975228101:2975228323, ack 2481859691, win 122, options [nop,nop,TS val 2336523213 ecr 4294914364], length 222
17:13:04.549910 IP 192.168.0.105.51525 > 91.189.95.36.80: Flags [.], ack 2975228323, win 123, options [nop,nop,TS val 4294914406 ecr 2336523213], length 0
17:13:04.549979 IP 91.189.95.36.80 > 192.168.0.105.51525: Flags [F.], seq 2975228323, ack 2481859691, win 122, options [nop,nop,TS val 2336523213 ecr 4294914364], length 0
17:13:04.588338 IP 192.168.0.105.51525 > 91.189.95.36.80: Flags [.], ack 2975228324, win 123, options [nop,nop,TS val 4294914416 ecr 2336523213], length 0
17:13:04.732388 IP 192.168.0.105.51525 > 91.189.95.36.80: Flags [F.], seq 2481859691, ack 2975228324, win 123, options [nop,nop,TS val 4294914451 ecr 2336523213], length 0
17:13:04.892045 IP 91.189.95.36.80 > 192.168.0.105.51525: Flags [.], ack 2481859692, win 122, options [nop,nop,TS val 2336523299 ecr 4294914451], length 0
17:13:07.516467 IP 192.168.0.101.52323 > 239.255.255.250.1900: UDP, length 420
17:13:07.519392 IP 192.168.0.101.52323 > 239.255.255.250.1900: UDP, length 429
17:13:07.524671 IP 192.168.0.101.52323 > 239.255.255.250.1900: UDP, length 476
17:13:07.617949 IP 192.168.0.101.52323 > 239.255.255.250.1900: UDP, length 484
17:13:07.623317 IP 192.168.0.101.52323 > 239.255.255.250.1900: UDP, length 486
17:13:07.628113 IP 192.168.0.101.52323 > 239.255.255.250.1900: UDP, length 474
17:13:07.632882 IP 192.168.0.101.52323 > 239.255.255.250.1900: UDP, length 460
17:13:07.637023 IP 192.168.0.101.52323 > 239.255.255.250.1900: UDP, length 462
17:13:07.720405 IP 192.168.0.101.52323 > 239.255.255.250.1900: UDP, length 420
17:13:07.822516 IP 192.168.0.101.52323 > 239.255.255.250.1900: UDP, length 429
17:13:07.828538 IP 192.168.0.101.52323 > 239.255.255.250.1900: UDP, length 476
17:13:07.832286 IP 192.168.0.101.52323 > 239.255.255.250.1900: UDP, length 484
17:13:07.836721 IP 192.168.0.101.52323 > 239.255.255.250.1900: UDP, length 486
17:13:07.841798 IP 192.168.0.101.52323 > 239.255.255.250.1900: UDP, length 474
17:13:07.926344 IP 192.168.0.101.52323 > 239.255.255.250.1900: UDP, length 460
17:13:07.930905 IP 192.168.0.101.52323 > 239.255.255.250.1900: UDP, length 462
ge17:13:11.357739 IP 192.168.0.105.17410 > 192.168.0.1.53: 32974+ A? productsearch.ubuntu.com. (42)
17:13:11.394253 IP 192.168.0.1.53 > 192.168.0.105.17410: 32974 2/3/3 A 91.189.92.9, A 91.189.92.8 (186)
17:13:11.394871 IP 192.168.0.105.55367 > 91.189.92.9.443: Flags [S], seq 3199184614, win 14600, options [mss 1460,sackOK,TS val 4294916117 ecr 0,nop,wscale 7], length 0
17:13:11.552304 IP 91.189.92.9.443 > 192.168.0.105.55367: Flags [S.], seq 2556755672, ack 3199184615, win 14480, options [mss 1460,sackOK,TS val 2079410562 ecr 4294916117,nop,wscale 6], length 0
17:13:11.552346 IP 192.168.0.105.55367 > 91.189.92.9.443: Flags [.], ack 2556755673, win 115, options [nop,nop,TS val 4294916157 ecr 2079410562], length 0
17:13:11.553602 IP 192.168.0.105.55367 > 91.189.92.9.443: Flags [P.], seq 3199184615:3199184765, ack 2556755673, win 115, options [nop,nop,TS val 4294916157 ecr 2079410562], length 150
17:13:11.708132 IP 91.189.92.9.443 > 192.168.0.105.55367: Flags [.], ack 3199184765, win 243, options [nop,nop,TS val 2079410601 ecr 4294916157], length 0
17:13:11.708155 IP 91.189.92.9.443 > 192.168.0.105.55367: Flags [.], ack 3199184765, win 243, options [nop,nop,TS val 2079410601 ecr 4294916157], length 0
17:13:11.714443 IP 91.189.92.9.443 > 192.168.0.105.55367: Flags [.], seq 2556755673:2556757075, ack 3199184765, win 243, options [nop,nop,TS val 2079410602 ecr 4294916157], length 1402
17:13:11.714471 IP 192.168.0.105.55367 > 91.189.92.9.443: Flags [.], ack 2556757075, win 137, options [nop,nop,TS val 4294916197 ecr 2079410602], length 0
17:13:11.717781 IP 91.189.92.9.443 > 192.168.0.105.55367: Flags [.], seq 2556757075:2556758477, ack 3199184765, win 243, options [nop,nop,TS val 2079410602 ecr 4294916157], length 1402
17:13:11.717794 IP 192.168.0.105.55367 > 91.189.92.9.443: Flags [.], ack 2556758477, win 160, options [nop,nop,TS val 4294916198 ecr 2079410602], length 0
17:13:11.717816 IP 91.189.92.9.443 > 192.168.0.105.55367: Flags [.], seq 2556758477:2556759879, ack 3199184765, win 243, options [nop,nop,TS val 2079410602 ecr 4294916157], length 1402
17:13:11.717824 IP 192.168.0.105.55367 > 91.189.92.9.443: Flags [.], ack 2556759879, win 182, options [nop,nop,TS val 4294916198 ecr 2079410602], length 0
17:13:11.717837 IP 91.189.92.9.443 > 192.168.0.105.55367: Flags [P.], seq 2556759879:2556760277, ack 3199184765, win 243, options [nop,nop,TS val 2079410602 ecr 4294916157], length 398
17:13:11.717846 IP 192.168.0.105.55367 > 91.189.92.9.443: Flags [.], ack 2556760277, win 204, options [nop,nop,TS val 4294916198 ecr 2079410602], length 0
17:13:11.745898 IP 192.168.0.105.55367 > 91.189.92.9.443: Flags [P.], seq 3199184765:3199184904, ack 2556760277, win 204, options [nop,nop,TS val 4294916205 ecr 2079410602], length 139
17:13:11.787916 IP 192.168.0.105.55367 > 91.189.92.9.443: Flags [FP.], seq 3199184904:3199184979, ack 2556760277, win 204, options [nop,nop,TS val 4294916215 ecr 2079410602], length 75
17:13:11.789156 IP 192.168.0.105.10897 > 192.168.0.1.53: 39344+ A? productsearch.ubuntu.com. (42)
17:13:11.795884 IP 192.168.0.1.53 > 192.168.0.105.10897: 39344 2/0/0 A 91.189.92.8, A 91.189.92.9 (74)
17:13:11.800899 IP 192.168.0.105.35650 > 91.189.92.8.443: Flags [S], seq 1217042682, win 14600, options [mss 1460,sackOK,TS val 4294916219 ecr 0,nop,wscale 7], length 0
17:13:11.940113 IP 91.189.92.9.443 > 192.168.0.105.55367: Flags [.], ack 3199184904, win 260, options [nop,nop,TS val 2079410659 ecr 4294916205], length 0
17:13:11.948265 IP 91.189.92.9.443 > 192.168.0.105.55367: Flags [P.], seq 2556760277:2556760352, ack 3199184980, win 260, options [nop,nop,TS val 2079410660 ecr 4294916215], length 75
17:13:11.948291 IP 192.168.0.105.55367 > 91.189.92.9.443: Flags [R], seq 3199184980, win 0, length 0
17:13:11.948313 IP 91.189.92.9.443 > 192.168.0.105.55367: Flags [P.], seq 2556760352:2556760405, ack 3199184980, win 260, options [nop,nop,TS val 2079410660 ecr 4294916215], length 53
17:13:11.948333 IP 192.168.0.105.55367 > 91.189.92.9.443: Flags [R], seq 3199184980, win 0, length 0
17:13:11.948345 IP 91.189.92.9.443 > 192.168.0.105.55367: Flags [F.], seq 2556760405, ack 3199184980, win 260, options [nop,nop,TS val 2079410660 ecr 4294916215], length 0
17:13:11.948349 IP 192.168.0.105.55367 > 91.189.92.9.443: Flags [R], seq 3199184980, win 0, length 0
17:13:11.958334 IP 91.189.92.8.443 > 192.168.0.105.35650: Flags [S.], seq 1825093061, ack 1217042683, win 14480, options [mss 1460,sackOK,TS val 2079410792 ecr 4294916219,nop,wscale 6], length 0
17:13:11.958453 IP 192.168.0.105.35650 > 91.189.92.8.443: Flags [.], ack 1825093062, win 115, options [nop,nop,TS val 4294916258 ecr 2079410792], length 0
17:13:11.960834 IP 192.168.0.105.35650 > 91.189.92.8.443: Flags [P.], seq 1217042683:1217042833, ack 1825093062, win 115, options [nop,nop,TS val 4294916259 ecr 2079410792], length 150
17:13:12.117852 IP 91.189.92.8.443 > 192.168.0.105.35650: Flags [.], ack 1217042833, win 243, options [nop,nop,TS val 2079410832 ecr 4294916259], length 0
17:13:12.123806 IP 91.189.92.8.443 > 192.168.0.105.35650: Flags [.], seq 1825093062:1825094464, ack 1217042833, win 243, options [nop,nop,TS val 2079410834 ecr 4294916259], length 1402
17:13:12.123818 IP 192.168.0.105.35650 > 91.189.92.8.443: Flags [.], ack 1825094464, win 137, options [nop,nop,TS val 4294916299 ecr 2079410834], length 0
17:13:12.125162 IP 91.189.92.8.443 > 192.168.0.105.35650: Flags [.], seq 1825094464:1825095866, ack 1217042833, win 243, options [nop,nop,TS val 2079410834 ecr 4294916259], length 1402
17:13:12.125174 IP 192.168.0.105.35650 > 91.189.92.8.443: Flags [.], ack 1825095866, win 160, options [nop,nop,TS val 4294916300 ecr 2079410834], length 0
17:13:12.125192 IP 91.189.92.8.443 > 192.168.0.105.35650: Flags [.], seq 1825095866:1825097268, ack 1217042833, win 243, options [nop,nop,TS val 2079410834 ecr 4294916259], length 1402
17:13:12.125197 IP 192.168.0.105.35650 > 91.189.92.8.443: Flags [.], ack 1825097268, win 182, options [nop,nop,TS val 4294916300 ecr 2079410834], length 0
17:13:12.128999 IP 91.189.92.8.443 > 192.168.0.105.35650: Flags [P.], seq 1825097268:1825097666, ack 1217042833, win 243, options [nop,nop,TS val 2079410834 ecr 4294916259], length 398
17:13:12.129055 IP 192.168.0.105.35650 > 91.189.92.8.443: Flags [.], ack 1825097666, win 204, options [nop,nop,TS val 4294916301 ecr 2079410834], length 0
17:13:12.152715 IP 192.168.0.105.35650 > 91.189.92.8.443: Flags [P.], seq 1217042833:1217042972, ack 1825097666, win 204, options [nop,nop,TS val 4294916307 ecr 2079410834], length 139
17:13:12.214121 IP 192.168.0.105.35650 > 91.189.92.8.443: Flags [FP.], seq 1217042972:1217043047, ack 1825097666, win 204, options [nop,nop,TS val 4294916322 ecr 2079410834], length 75
17:13:12.217297 IP 192.168.0.105.41743 > 192.168.0.1.53: 30410+ A? productsearch.ubuntu.com. (42)
17:13:12.220975 IP 192.168.0.1.53 > 192.168.0.105.41743: 30410 2/0/0 A 91.189.92.9, A 91.189.92.8 (74)
17:13:12.223176 IP 192.168.0.105.55369 > 91.189.92.9.443: Flags [S], seq 3762497052, win 14600, options [mss 1460,sackOK,TS val 4294916324 ecr 0,nop,wscale 7], length 0
17:13:12.345430 IP 91.189.92.8.443 > 192.168.0.105.35650: Flags [.], ack 1217042972, win 260, options [nop,nop,TS val 2079410890 ecr 4294916307], length 0
17:13:12.350113 IP 192.168.0.105.26363 > 192.168.0.1.53: 24266+ A? productsearch.ubuntu.com. (42)
17:13:12.353616 IP 192.168.0.1.53 > 192.168.0.105.26363: 24266 2/0/0 A 91.189.92.8, A 91.189.92.9 (74)
17:13:12.357803 IP 192.168.0.105.35652 > 91.189.92.8.443: Flags [S], seq 178910374, win 14600, options [mss 1460,sackOK,TS val 4294916358 ecr 0,nop,wscale 7], length 0
17:13:12.386169 IP 91.189.92.9.443 > 192.168.0.105.55369: Flags [S.], seq 371747802, ack 3762497053, win 14480, options [mss 1460,sackOK,TS val 2079410771 ecr 4294916324,nop,wscale 6], length 0
17:13:12.386212 IP 192.168.0.105.55369 > 91.189.92.9.443: Flags [.], ack 371747803, win 115, options [nop,nop,TS val 4294916365 ecr 2079410771], length 0
17:13:12.386242 IP 91.189.92.8.443 > 192.168.0.105.35650: Flags [P.], seq 1825097666:1825097741, ack 1217043048, win 260, options [nop,nop,TS val 2079410900 ecr 4294916322], length 75
17:13:12.386260 IP 192.168.0.105.35650 > 91.189.92.8.443: Flags [R], seq 1217043048, win 0, length 0
17:13:12.386276 IP 91.189.92.8.443 > 192.168.0.105.35650: Flags [P.], seq 1825097741:1825097794, ack 1217043048, win 260, options [nop,nop,TS val 2079410900 ecr 4294916322], length 53
17:13:12.386290 IP 192.168.0.105.35650 > 91.189.92.8.443: Flags [R], seq 1217043048, win 0, length 0
17:13:12.386301 IP 91.189.92.8.443 > 192.168.0.105.35650: Flags [F.], seq 1825097794, ack 1217043048, win 260, options [nop,nop,TS val 2079410900 ecr 4294916322], length 0
17:13:12.386306 IP 192.168.0.105.35650 > 91.189.92.8.443: Flags [R], seq 1217043048, win 0, length 0
17:13:12.520272 IP 91.189.92.8.443 > 192.168.0.105.35652: Flags [S.], seq 3352575399, ack 178910375, win 14480, options [mss 1460,sackOK,TS val 2079410933 ecr 4294916358,nop,wscale 6], length 0
17:13:12.520327 IP 192.168.0.105.35652 > 91.189.92.8.443: Flags [.], ack 3352575400, win 115, options [nop,nop,TS val 4294916399 ecr 2079410933], length 0
17:13:12.521281 IP 192.168.0.105.35652 > 91.189.92.8.443: Flags [P.], seq 178910375:178910525, ack 3352575400, win 115, options [nop,nop,TS val 4294916399 ecr 2079410933], length 150
17:13:12.614226 IP 192.168.0.105.35652 > 91.189.92.8.443: Flags [F.], seq 178910525, ack 3352575400, win 115, options [nop,nop,TS val 4294916422 ecr 2079410933], length 0
17:13:12.622838 IP 192.168.0.105.9798 > 192.168.0.1.53: 17649+ A? productsearch.ubuntu.com. (42)
17:13:12.625991 IP 192.168.0.1.53 > 192.168.0.105.9798: 17649 2/0/0 A 91.189.92.9, A 91.189.92.8 (74)
17:13:12.630102 IP 192.168.0.105.55371 > 91.189.92.9.443: Flags [S], seq 3575636195, win 14600, options [mss 1460,sackOK,TS val 4294916426 ecr 0,nop,wscale 7], length 0
17:13:12.675931 IP 91.189.92.8.443 > 192.168.0.105.35652: Flags [.], ack 178910525, win 243, options [nop,nop,TS val 2079410972 ecr 4294916399], length 0
17:13:12.683591 IP 91.189.92.8.443 > 192.168.0.105.35652: Flags [.], seq 3352575400:3352576802, ack 178910525, win 243, options [nop,nop,TS val 2079410973 ecr 4294916399], length 1402
17:13:12.683626 IP 192.168.0.105.35652 > 91.189.92.8.443: Flags [R], seq 178910525, win 0, length 0
17:13:12.684299 IP 91.189.92.8.443 > 192.168.0.105.35652: Flags [.], seq 3352576802:3352578204, ack 178910525, win 243, options [nop,nop,TS val 2079410973 ecr 4294916399], length 1402
17:13:12.684318 IP 192.168.0.105.35652 > 91.189.92.8.443: Flags [R], seq 178910525, win 0, length 0
17:13:12.685583 IP 91.189.92.8.443 > 192.168.0.105.35652: Flags [.], seq 3352578204:3352579606, ack 178910525, win 243, options [nop,nop,TS val 2079410973 ecr 4294916399], length 1402
17:13:12.685607 IP 192.168.0.105.35652 > 91.189.92.8.443: Flags [R], seq 178910525, win 0, length 0
17:13:12.685631 IP 91.189.92.8.443 > 192.168.0.105.35652: Flags [P.], seq 3352579606:3352580004, ack 178910525, win 243, options [nop,nop,TS val 2079410973 ecr 4294916399], length 398
17:13:12.685636 IP 192.168.0.105.35652 > 91.189.92.8.443: Flags [R], seq 178910525, win 0, length 0
17:13:12.771463 IP 91.189.92.8.443 > 192.168.0.105.35652: Flags [F.], seq 3352580004, ack 178910526, win 243, options [nop,nop,TS val 2079410996 ecr 4294916422], length 0
17:13:12.771494 IP 192.168.0.105.35652 > 91.189.92.8.443: Flags [R], seq 178910526, win 0, length 0
17:13:12.785522 IP 91.189.92.9.443 > 192.168.0.105.55371: Flags [S.], seq 2725872483, ack 3575636196, win 14480, options [mss 1460,sackOK,TS val 2079410871 ecr 4294916426,nop,wscale 6], length 0
17:13:12.785577 IP 192.168.0.105.55371 > 91.189.92.9.443: Flags [.], ack 2725872484, win 115, options [nop,nop,TS val 4294916465 ecr 2079410871], length 0
17:13:12.806915 IP 192.168.0.105.55371 > 91.189.92.9.443: Flags [P.], seq 3575636196:3575636346, ack 2725872484, win 115, options [nop,nop,TS val 4294916470 ecr 2079410871], length 150
17:13:12.965541 IP 91.189.92.9.443 > 192.168.0.105.55371: Flags [.], ack 3575636346, win 243, options [nop,nop,TS val 2079410915 ecr 4294916470], length 0
17:13:12.971883 IP 91.189.92.9.443 > 192.168.0.105.55371: Flags [.], seq 2725872484:2725873886, ack 3575636346, win 243, options [nop,nop,TS val 2079410917 ecr 4294916470], length 1402
17:13:12.971979 IP 192.168.0.105.55371 > 91.189.92.9.443: Flags [.], ack 2725873886, win 137, options [nop,nop,TS val 4294916511 ecr 2079410917], length 0
17:13:12.972623 IP 91.189.92.9.443 > 192.168.0.105.55371: Flags [.], seq 2725873886:2725875288, ack 3575636346, win 243, options [nop,nop,TS val 2079410917 ecr 4294916470], length 1402
17:13:12.972663 IP 192.168.0.105.55371 > 91.189.92.9.443: Flags [.], ack 2725875288, win 160, options [nop,nop,TS val 4294916512 ecr 2079410917], length 0
17:13:12.973333 IP 91.189.92.9.443 > 192.168.0.105.55371: Flags [.], seq 2725875288:2725876690, ack 3575636346, win 243, options [nop,nop,TS val 2079410917 ecr 4294916470], length 1402
17:13:12.973351 IP 192.168.0.105.55371 > 91.189.92.9.443: Flags [.], ack 2725876690, win 182, options [nop,nop,TS val 4294916512 ecr 2079410917], length 0
17:13:12.973698 IP 91.189.92.9.443 > 192.168.0.105.55371: Flags [P.], seq 2725876690:2725877088, ack 3575636346, win 243, options [nop,nop,TS val 2079410917 ecr 4294916470], length 398
17:13:12.973706 IP 192.168.0.105.55371 > 91.189.92.9.443: Flags [.], ack 2725877088, win 204, options [nop,nop,TS val 4294916512 ecr 2079410917], length 0
17:13:13.004946 IP 192.168.0.105.55371 > 91.189.92.9.443: Flags [P.], seq 3575636346:3575636485, ack 2725877088, win 204, options [nop,nop,TS val 4294916520 ecr 2079410917], length 139
17:13:13.208784 IP 91.189.92.9.443 > 192.168.0.105.55371: Flags [.], ack 3575636485, win 260, options [nop,nop,TS val 2079410977 ecr 4294916520], length 0
17:13:13.208784 IP 192.168.0.105.55371 > 91.189.92.9.443: Flags [P.], seq 3575636485:3575636560, ack 2725877088, win 204, options [nop,nop,TS val 4294916571 ecr 2079410977], length 75
17:13:13.365320 IP 91.189.92.9.443 > 192.168.0.105.55371: Flags [.], ack 3575636560, win 260, options [nop,nop,TS val 2079411015 ecr 4294916571], length 0
17:13:13.365356 IP 91.189.92.9.443 > 192.168.0.105.55371: Flags [P.], seq 2725877088:2725877163, ack 3575636560, win 260, options [nop,nop,TS val 2079411015 ecr 4294916571], length 75
17:13:13.378843 IP 192.168.0.105.55371 > 91.189.92.9.443: Flags [P.], seq 3575636560:3575636613, ack 2725877163, win 204, options [nop,nop,TS val 4294916613 ecr 2079411015], length 53
17:13:13.391274 IP 192.168.0.105.55371 > 91.189.92.9.443: Flags [F.], seq 3575636613, ack 2725877163, win 204, options [nop,nop,TS val 4294916616 ecr 2079411015], length 0
17:13:13.393043 IP 192.168.0.105.10603 > 192.168.0.1.53: 64623+ A? productsearch.ubuntu.com. (42)
17:13:13.394750 IP 192.168.0.1.53 > 192.168.0.105.10603: 64623 2/0/0 A 91.189.92.8, A 91.189.92.9 (74)
17:13:13.407462 IP 192.168.0.105.46899 > 192.168.0.1.53: 64554+ A? productsearch.ubuntu.com. (42)
17:13:13.409168 IP 192.168.0.1.53 > 192.168.0.105.46899: 64554 2/0/0 A 91.189.92.9, A 91.189.92.8 (74)
17:13:13.409505 IP 192.168.0.105.55372 > 91.189.92.9.443: Flags [S], seq 1997429628, win 14600, options [mss 1460,sackOK,TS val 4294916621 ecr 0,nop,wscale 7], length 0
17:13:13.532229 IP 91.189.92.9.443 > 192.168.0.105.55371: Flags [P.], seq 2725877163:2725877216, ack 3575636613, win 260, options [nop,nop,TS val 2079411057 ecr 4294916613], length 53
17:13:13.532347 IP 192.168.0.105.55371 > 91.189.92.9.443: Flags [R], seq 3575636613, win 0, length 0
17:13:13.532405 IP 91.189.92.9.443 > 192.168.0.105.55371: Flags [F.], seq 2725877216, ack 3575636613, win 260, options [nop,nop,TS val 2079411057 ecr 4294916613], length 0
17:13:13.532416 IP 192.168.0.105.55371 > 91.189.92.9.443: Flags [R], seq 3575636613, win 0, length 0
17:13:13.550206 IP 91.189.92.9.443 > 192.168.0.105.55371: Flags [.], ack 3575636614, win 260, options [nop,nop,TS val 2079411060 ecr 4294916616], length 0
17:13:13.550229 IP 192.168.0.105.55371 > 91.189.92.9.443: Flags [R], seq 3575636614, win 0, length 0
17:13:13.552213 IP 91.189.92.9.443 > 192.168.0.105.55369: Flags [S.], seq 371747802, ack 3762497053, win 14480, options [mss 1460,sackOK,TS val 2079411063 ecr 4294916365,nop,wscale 6], length 0
17:13:13.552227 IP 192.168.0.105.55369 > 91.189.92.9.443: Flags [.], ack 371747803, win 115, options [nop,nop,TS val 4294916656 ecr 2079411063,nop,nop,sack 1 {371747802:371747803}], length 0
17:13:13.582810 IP 91.189.92.9.443 > 192.168.0.105.55372: Flags [S.], seq 3923070017, ack 1997429629, win 14480, options [mss 1460,sackOK,TS val 2079411069 ecr 4294916621,nop,wscale 6], length 0
17:13:13.582874 IP 192.168.0.105.55372 > 91.189.92.9.443: Flags [.], ack 3923070018, win 115, options [nop,nop,TS val 4294916664 ecr 2079411069], length 0
17:13:13.584597 IP 192.168.0.105.55372 > 91.189.92.9.443: Flags [P.], seq 1997429629:1997429779, ack 3923070018, win 115, options [nop,nop,TS val 4294916665 ecr 2079411069], length 150
17:13:13.743464 IP 91.189.92.9.443 > 192.168.0.105.55372: Flags [.], ack 1997429779, win 243, options [nop,nop,TS val 2079411110 ecr 4294916665], length 0
17:13:13.751466 IP 91.189.92.9.443 > 192.168.0.105.55372: Flags [.], seq 3923070018:3923071420, ack 1997429779, win 243, options [nop,nop,TS val 2079411112 ecr 4294916665], length 1402
17:13:13.751541 IP 192.168.0.105.55372 > 91.189.92.9.443: Flags [.], ack 3923071420, win 137, options [nop,nop,TS val 4294916706 ecr 2079411112], length 0
17:13:13.754691 IP 91.189.92.9.443 > 192.168.0.105.55372: Flags [.], seq 3923071420:3923072822, ack 1997429779, win 243, options [nop,nop,TS val 2079411112 ecr 4294916665], length 1402
17:13:13.754712 IP 192.168.0.105.55372 > 91.189.92.9.443: Flags [.], ack 3923072822, win 160, options [nop,nop,TS val 4294916707 ecr 2079411112], length 0
17:13:13.755845 IP 91.189.92.9.443 > 192.168.0.105.55372: Flags [.], seq 3923072822:3923074224, ack 1997429779, win 243, options [nop,nop,TS val 2079411112 ecr 4294916665], length 1402
17:13:13.755857 IP 192.168.0.105.55372 > 91.189.92.9.443: Flags [.], ack 3923074224, win 182, options [nop,nop,TS val 4294916707 ecr 2079411112], length 0
17:13:13.755875 IP 91.189.92.9.443 > 192.168.0.105.55372: Flags [P.], seq 3923074224:3923074622, ack 1997429779, win 243, options [nop,nop,TS val 2079411112 ecr 4294916665], length 398
17:13:13.755881 IP 192.168.0.105.55372 > 91.189.92.9.443: Flags [.], ack 3923074622, win 204, options [nop,nop,TS val 4294916707 ecr 2079411112], length 0
17:13:13.803174 IP 192.168.0.105.55372 > 91.189.92.9.443: Flags [P.], seq 1997429779:1997429918, ack 3923074622, win 204, options [nop,nop,TS val 4294916719 ecr 2079411112], length 139
17:13:14.004036 IP 91.189.92.9.443 > 192.168.0.105.55372: Flags [.], ack 1997429918, win 260, options [nop,nop,TS val 2079411174 ecr 4294916719], length 0
17:13:14.004074 IP 192.168.0.105.55372 > 91.189.92.9.443: Flags [P.], seq 1997429918:1997429993, ack 3923074622, win 204, options [nop,nop,TS val 4294916769 ecr 2079411174], length 75
17:13:14.169608 IP 91.189.92.9.443 > 192.168.0.105.55372: Flags [.], ack 1997429993, win 260, options [nop,nop,TS val 2079411217 ecr 4294916769], length 0
17:13:14.170040 IP 91.189.92.9.443 > 192.168.0.105.55372: Flags [P.], seq 3923074622:3923074697, ack 1997429993, win 260, options [nop,nop,TS val 2079411217 ecr 4294916769], length 75
17:13:14.170054 IP 192.168.0.105.55372 > 91.189.92.9.443: Flags [.], ack 3923074697, win 204, options [nop,nop,TS val 4294916811 ecr 2079411217], length 0
17:13:14.182254 IP 192.168.0.105.55372 > 91.189.92.9.443: Flags [P.], seq 1997429993:1997430174, ack 3923074697, win 204, options [nop,nop,TS val 4294916814 ecr 2079411217], length 181
17:13:14.342143 IP 91.189.92.9.443 > 192.168.0.105.55372: Flags [P.], seq 3923074697:3923075955, ack 1997430174, win 277, options [nop,nop,TS val 2079411259 ecr 4294916814], length 1258
17:13:14.380249 IP 192.168.0.105.55372 > 91.189.92.9.443: Flags [.], ack 3923075955, win 227, options [nop,nop,TS val 4294916864 ecr 2079411259], length 0
17:13:16.754686 IP6 fe80::15b:24dc:784e:9185.546 > ff02::1:2.547: dhcp6 solicit
17:13:19.343351 IP 91.189.92.9.443 > 192.168.0.105.55372: Flags [P.], seq 3923075955:3923076008, ack 1997430174, win 277, options [nop,nop,TS val 2079412510 ecr 4294916864], length 53
17:13:19.343490 IP 192.168.0.105.55372 > 91.189.92.9.443: Flags [.], ack 3923076008, win 227, options [nop,nop,TS val 4294918104 ecr 2079412510], length 0
17:13:19.344816 IP 91.189.92.9.443 > 192.168.0.105.55372: Flags [F.], seq 3923076008, ack 1997430174, win 277, options [nop,nop,TS val 2079412510 ecr 4294916864], length 0
17:13:19.384792 IP 192.168.0.105.55372 > 91.189.92.9.443: Flags [.], ack 3923076009, win 227, options [nop,nop,TS val 4294918115 ecr 2079412510], length
